{
  "schema_version": "1.1",
  "tool": { "name": "wall-scan", "version": "0.3.0" },
  "started_at": "2026-10-08T09:30:00Z",
  "duration_ms": 41230,
  "status": "ok",
  "errors": [],
  "params": {
    "targets": ["192.168.1.0/24"],
    "ports": "22,80,443,445,3389,9100",
    "privileged": true,
    "timeout_s": 600
  },
  "result": {
    "engine": { "name": "nmap", "version": "7.94SVN" },
    "hosts_scanned": 256,
    "devices": [
      {
        "ip": "192.168.1.1",
        "mac": "50:c7:bf:12:34:56",
        "vendor": "TP-Link Technologies",
        "hostname": "router.lan",
        "discovery_reason": "arp-response",
        "open_ports": [
          { "port": 80, "protocol": "tcp", "service": "http" },
          { "port": 443, "protocol": "tcp", "service": "https" }
        ]
      },
      {
        "ip": "192.168.1.10",
        "mac": null,
        "vendor": null,
        "hostname": "wall-vm.lan",
        "discovery_reason": "localhost-response",
        "open_ports": [
          { "port": 22, "protocol": "tcp", "service": "ssh" }
        ]
      },
      {
        "ip": "192.168.1.20",
        "mac": "d4:81:d7:0a:1b:2c",
        "vendor": "Dell",
        "hostname": "office-pc01.lan",
        "discovery_reason": "arp-response",
        "open_ports": [
          { "port": 445, "protocol": "tcp", "service": "microsoft-ds" },
          { "port": 3389, "protocol": "tcp", "service": "ms-wbt-server" }
        ]
      },
      {
        "ip": "192.168.1.50",
        "mac": "3c:52:82:ab:cd:ef",
        "vendor": "Hewlett Packard",
        "hostname": "npi1a2b3c.lan",
        "discovery_reason": "arp-response",
        "open_ports": [
          { "port": 80, "protocol": "tcp", "service": "http" },
          { "port": 443, "protocol": "tcp", "service": "https" },
          { "port": 9100, "protocol": "tcp", "service": "jetdirect" }
        ]
      },
      {
        "ip": "192.168.1.77",
        "mac": "6a:1f:3e:90:22:41",
        "vendor": null,
        "hostname": null,
        "discovery_reason": "arp-response",
        "open_ports": []
      }
    ],
    "networks": [
      {
        "network": "192.168.1.0/24",
        "attached": true,
        "interface": "eth0",
        "address": "192.168.1.10",
        "gateway": "192.168.1.1"
      }
    ]
  }
}
